{
  "batch_id": "batch_12345678",
  "complete_enumeration": false,
  "contents": [],
  "cursor": "cursor_41",
  "entities": [
    {
      "aliases": [
        "AskDev"
      ],
      "authorization": {
        "project_ids": [
          "project_ask_dev"
        ]
      },
      "evidence_ref_ids": [
        "evidence_project_identity"
      ],
      "observed_at": "2026-08-11T15:59:00Z",
      "previous_names": [
        "Dev Agent"
      ],
      "properties": {
        "lifecycle": {
          "string": "in_progress"
        }
      },
      "provider_aliases": [
        "github:full-chaos/ask-dev"
      ],
      "provider_ids": {
        "linear_project_id": "linear_project_123"
      },
      "source_version": "ops-projection-v1",
      "subject": {
        "canonical_id": "project_ask_dev",
        "kind": "project",
        "label": "Ask Dev"
      }
    }
  ],
  "episodes": [],
  "full_snapshot": false,
  "generated_at": "2026-08-11T16:00:00Z",
  "next_cursor": "cursor_42",
  "org_id": "org_1",
  "relationships": [
    {
      "authorization": {
        "repository_slugs": [
          "full-chaos/dev-health-acr"
        ]
      },
      "derivation": "canonical_structured",
      "epistemic_status": "observed",
      "evidence_ref_ids": [
        "acr:v1:pull-request:repo_1:42"
      ],
      "from": {
        "canonical_id": "pull_request:repo_1:42",
        "kind": "pull_request",
        "label": "PR #42"
      },
      "observed_at": "2026-08-11T15:59:00Z",
      "properties": {},
      "relationship_id": "relationship_belongs_to_repository_1",
      "source_version": "ops-projection-v1",
      "to": {
        "canonical_id": "repository:repo_1",
        "kind": "repository",
        "label": "full-chaos/dev-health-acr"
      },
      "type": "BELONGS_TO_REPOSITORY"
    },
    {
      "authorization": {
        "repository_slugs": [
          "full-chaos/dev-health-acr"
        ]
      },
      "derivation": "canonical_structured",
      "epistemic_status": "observed",
      "evidence_ref_ids": [
        "acr:v1:review.v2:00000000-0000-0000-0000-000000000000:42:review_1"
      ],
      "from": {
        "canonical_id": "pull_request_review:review_1",
        "kind": "pull_request_review",
        "label": "PR #42 review"
      },
      "observed_at": "2026-08-11T15:59:00Z",
      "properties": {},
      "relationship_id": "relationship_belongs_to_pull_request_1",
      "source_version": "ops-projection-v1",
      "to": {
        "canonical_id": "pull_request:repo_1:42",
        "kind": "pull_request",
        "label": "PR #42"
      },
      "type": "BELONGS_TO_PULL_REQUEST"
    },
    {
      "authorization": {
        "repository_slugs": [
          "full-chaos/dev-health-acr"
        ]
      },
      "derivation": "rule_inferred",
      "epistemic_status": "source_asserted",
      "evidence_ref_ids": [
        "acr:v1:deployment-incident:edge_1"
      ],
      "from": {
        "canonical_id": "deployment:deploy_1",
        "kind": "deployment",
        "label": "production deployment"
      },
      "observed_at": "2026-08-11T15:59:00Z",
      "properties": {},
      "relationship_id": "relationship_correlated_with_incident_1",
      "source_version": "ops-projection-v1",
      "to": {
        "canonical_id": "incident:incident_1",
        "kind": "incident",
        "label": "Elevated error rate"
      },
      "type": "CORRELATED_WITH_INCIDENT"
    },
    {
      "authorization": {
        "repository_slugs": [
          "full-chaos/dev-health-acr"
        ]
      },
      "derivation": "canonical_structured",
      "epistemic_status": "observed",
      "evidence_ref_ids": [
        "acr:v1:work-item-dependency:CHAOS-2001:CHAOS-2002"
      ],
      "from": {
        "canonical_id": "work_item:CHAOS-2001",
        "kind": "work_item",
        "label": "CHAOS-2001"
      },
      "observed_at": "2026-08-11T15:59:00Z",
      "properties": {},
      "relationship_id": "relationship_related_to_1",
      "source_version": "ops-projection-v1",
      "to": {
        "canonical_id": "work_item:CHAOS-2002",
        "kind": "work_item",
        "label": "CHAOS-2002"
      },
      "type": "RELATED_TO"
    },
    {
      "authorization": {
        "repository_slugs": [
          "full-chaos/dev-health-acr"
        ]
      },
      "derivation": "canonical_structured",
      "epistemic_status": "observed",
      "evidence_ref_ids": [
        "acr:v1:work-item-dependency:CHAOS-2003:CHAOS-2004"
      ],
      "from": {
        "canonical_id": "work_item:CHAOS-2003",
        "kind": "work_item",
        "label": "CHAOS-2003"
      },
      "observed_at": "2026-08-11T15:59:00Z",
      "properties": {},
      "relationship_id": "relationship_blocks_1",
      "source_version": "ops-projection-v1",
      "to": {
        "canonical_id": "work_item:CHAOS-2004",
        "kind": "work_item",
        "label": "CHAOS-2004"
      },
      "type": "BLOCKS"
    },
    {
      "authorization": {
        "repository_slugs": [
          "full-chaos/dev-health-acr"
        ]
      },
      "derivation": "canonical_structured",
      "epistemic_status": "observed",
      "evidence_ref_ids": [
        "acr:v1:work-item-hierarchy:CHAOS-2005:CHAOS-2000"
      ],
      "from": {
        "canonical_id": "work_item:CHAOS-2005",
        "kind": "work_item",
        "label": "CHAOS-2005"
      },
      "observed_at": "2026-08-11T15:59:00Z",
      "properties": {},
      "relationship_id": "relationship_part_of_1",
      "source_version": "ops-projection-v1",
      "to": {
        "canonical_id": "work_item:CHAOS-2000",
        "kind": "work_item",
        "label": "CHAOS-2000"
      },
      "type": "PART_OF"
    },
    {
      "authorization": {
        "repository_slugs": [
          "full-chaos/dev-health-acr"
        ]
      },
      "derivation": "canonical_structured",
      "epistemic_status": "observed",
      "evidence_ref_ids": [
        "acr:v1:work-item-dependency:CHAOS-2006:CHAOS-2007"
      ],
      "from": {
        "canonical_id": "work_item:CHAOS-2006",
        "kind": "work_item",
        "label": "CHAOS-2006"
      },
      "observed_at": "2026-08-11T15:59:00Z",
      "properties": {},
      "relationship_id": "relationship_relates_to_1",
      "source_version": "ops-projection-v1",
      "to": {
        "canonical_id": "work_item:CHAOS-2007",
        "kind": "work_item",
        "label": "CHAOS-2007"
      },
      "type": "RELATES_TO"
    },
    {
      "authorization": {
        "repository_slugs": [
          "full-chaos/dev-health-acr"
        ]
      },
      "derivation": "canonical_structured",
      "epistemic_status": "observed",
      "evidence_ref_ids": [
        "acr:v1:work-item-dependency:CHAOS-2008:CHAOS-2009"
      ],
      "from": {
        "canonical_id": "work_item:CHAOS-2008",
        "kind": "work_item",
        "label": "CHAOS-2008"
      },
      "observed_at": "2026-08-11T15:59:00Z",
      "properties": {},
      "relationship_id": "relationship_duplicates_1",
      "source_version": "ops-projection-v1",
      "to": {
        "canonical_id": "work_item:CHAOS-2009",
        "kind": "work_item",
        "label": "CHAOS-2009"
      },
      "type": "DUPLICATES"
    },
    {
      "authorization": {
        "repository_slugs": [
          "acr-context-fabric:no-repository"
        ]
      },
      "derivation": "rule_inferred",
      "epistemic_status": "source_asserted",
      "evidence_ref_ids": [
        "acr:v1:work-item-team.v2:00000000-0000-0000-0000-000000000000:linear%3ACHAOS-3802:CHAOS:native_team"
      ],
      "from": {
        "canonical_id": "work_item.v2:00000000-0000-0000-0000-000000000000:linear%3ACHAOS-3802",
        "kind": "work_item",
        "label": "linear:CHAOS-3802"
      },
      "observed_at": "2026-08-13T19:00:02.504Z",
      "properties": {
        "attribution_confidence": {
          "string": "high"
        },
        "attribution_source": {
          "string": "native_team"
        }
      },
      "relationship_id": "relationship.v2:work_item_team:8dce29ed83b79174cd7aaf8a149a035a",
      "source_version": "devhealthsource.teams_projects.v22",
      "to": {
        "canonical_id": "team:CHAOS",
        "kind": "team",
        "label": "CHAOS"
      },
      "type": "OWNED_BY_TEAM"
    },
    {
      "authorization": {
        "repository_slugs": [
          "full.chaos/dev-health-ops"
        ]
      },
      "derivation": "rule_inferred",
      "epistemic_status": "inferred",
      "evidence_ref_ids": [
        "acr:v1:work-item-team.v2:00000000-0000-0000-0000-000000000000:gl%3A42:gl%3Afull.chaos:project_ownership"
      ],
      "from": {
        "canonical_id": "work_item.v2:cd620f84-2602-8dea-7809-8d1f11825cf4:gl%3A42",
        "kind": "work_item",
        "label": "gl:42"
      },
      "observed_at": "2026-08-13T19:00:02.504Z",
      "properties": {
        "attribution_confidence": {
          "string": "medium"
        },
        "attribution_source": {
          "string": "project_ownership"
        }
      },
      "relationship_id": "relationship.v2:work_item_team:9f75989e94c47882f0eb87d473827a63",
      "source_version": "devhealthsource.teams_projects.v22",
      "to": {
        "canonical_id": "team:gl:full.chaos",
        "kind": "team",
        "label": "gl:full.chaos"
      },
      "type": "OWNED_BY_TEAM"
    },
    {
      "authorization": {
        "project_ids": [
          "70d529e0-3c06-4597-8480-794fd02328b6:gitlab:71133891"
        ],
        "team_ids": [
          "gl:full.chaos"
        ]
      },
      "derivation": "rule_inferred",
      "epistemic_status": "source_asserted",
      "evidence_ref_ids": [
        "acr:v1:project-team.v2:github:70d529e0-3c06-4597-8480-794fd02328b6%3Agitlab%3A71133891:gl%3Afull.chaos:native"
      ],
      "from": {
        "canonical_id": "project.v2:github:70d529e0-3c06-4597-8480-794fd02328b6%3Agitlab%3A71133891",
        "kind": "project",